{
  "schema_version": "ghostark.research.human_review_decision.v1",
  "decision_id": "hrd_fixture_escalation_001",
  "queue_item_id": "hrq_fixture_escalation_001",
  "decided_at": "2026-07-09T14:10:00.000Z",
  "reviewer": {
    "reviewer_role": "security_reviewer",
    "reviewer_id_hash": "hmac-sha256:9999999999999999999999999999999999999999999999999999999999999999"
  },
  "disposition": "escalated",
  "rationale_codes": ["receipt_integrity_requires_investigation"],
  "rationale_digest": "sha256:cccccccccccccccccccccccccccccccccccccccccccccccccccccccccccccccc",
  "receipt_references": [
    {
      "receipt_id": "rct_292264b449c853481a45c4df9ceff87641f53cf0fc982dc013987f9ab696ba15",
      "receipt_digest": "sha256:67bad9140ee958eda4639cefe7a3ef84645a748db1005e6a40bf3368aa94c812"
    }
  ],
  "evidence_references": [
    {
      "artifact_type": "review_queue_item",
      "artifact_id": "hrq_fixture_escalation_001",
      "artifact_digest": "sha256:bbbbbbbbbbbbbbbbbbbbbbbbbbbbbbbbbbbbbbbbbbbbbbbbbbbbbbbbbbbbbbbb"
    },
    {
      "artifact_type": "verifier_report",
      "artifact_id": "verifier_report_fixture_failed_001",
      "artifact_digest": "sha256:aaaaaaaaaaaaaaaaaaaaaaaaaaaaaaaaaaaaaaaaaaaaaaaaaaaaaaaaaaaaaaaa"
    }
  ],
  "escalation": {
    "required": true,
    "incident_id": "inc_fixture_receipt_integrity_001",
    "reason_code": "receipt_integrity_failure"
  },
  "privacy": {
    "raw_content_included": false,
    "notes_storage": "digest_only",
    "redaction_policy_digest": "sha256:eeeeeeeeeeeeeeeeeeeeeeeeeeeeeeeeeeeeeeeeeeeeeeeeeeeeeeeeeeeeeeee"
  },
  "audit": {
    "event_id": "audit_escalated_decision_001",
    "event_digest": "sha256:dddddddddddddddddddddddddddddddddddddddddddddddddddddddddddddddd",
    "previous_event_digest": "sha256:bbbbbbbbbbbbbbbbbbbbbbbbbbbbbbbbbbbbbbbbbbbbbbbbbbbbbbbbbbbbbbbb"
  },
  "non_claims": [
    "Escalation records a workflow transition; it does not prove incident severity, causation, or impact.",
    "This fixture does not demonstrate an operating incident response team."
  ]
}
